{
  "$schema": "http://json-schema.org/draft-04/schema#",
  "type": "object",
  "properties": {
    "_id":              {},
    "firstname":        { "type": "string" },
    "lastname":         { "type": "string" },

    "project":          {},
    "created":          {},
    "modified":         {},
    "revision":         {},
    "permissions":      {},
    "public":           {},

    "sex":              { "$ref": "../definitions/subject.json#/definitions/sex" },
    "cohort":           { "$ref": "../definitions/subject.json#/definitions/cohort" },
    "type":             { "$ref": "../definitions/subject.json#/definitions/type" },
    "race":             { "$ref": "../definitions/subject.json#/definitions/race" },
    "ethnicity":        { "$ref": "../definitions/subject.json#/definitions/ethnicity" },
    "species":          { "type": "string" },
    "strain":           { "type": "string" },

    "code":             { "type": "string" },
    "master_code":      { "type": "string" },
    "label":            { "type": "string" },
    "tags":             { "type": "array", "items": {"type": "string"} },
    "files":            {
                          "type": ["array", "null"],
                          "items": {"$ref": "file.json"}
                        },
    "info":             { "type": "object" }
  },
  "additionalProperties": false
}
