{
    "_id": "57e01cccb1dc04000fb83f02",
    "project": "57e01cccf6b5d5edbcb4e1cf",
    "code": "ex4784",

    "firstname": "Johnny",
    "lastname": "Appleseed",
    "sex": "male",
    "type": "human",
    "race": "More Than One Race",
    "ethnicity": "Not Hispanic or Latino",
    "cohort": "Validation",

    "created": "2016-09-19T17:13:48.164000+00:00",
    "modified": "2016-09-19T17:13:48.164000+00:00",
    "public": false,
    "permissions": [{
        "access": "admin",
        "_id": "57e01cccf6b5d5ed2cb4e182"
    }]
}
